subject,sona_id,curTime,totalTime_mins,screen_width,screen_height,window_width,window_height,age,gender,race,ethnicity,vision,comments,cog_effort_q1,cog_effort_q2,cog_effort_q3,cog_effort_q4,cog_effort_q5,cog_effort_q6,cog_effort_q7,cog_effort_q8,cog_effort_q9,cog_effort_q10,cog_effort_q11,cog_effort_q12,cog_effort_q13,cog_effort_q14,cog_effort_q15,cog_effort_q16,cog_effort_q17,cog_effort_q18
3m437wyj24y,13476,28/03/2022@12:07:05,null,1440,900,1254,1209,18,female,white,not_hispanic,corrected,I prefered the two outcomes because I had a challenge.,strongly_disagree,somewhat_disagree,strongly_agree,somewhat_agree,somewhat_agree,strongly_disagree,strongly_agree,somewhat_agree,somewhat_agree,neutral,strongly_disagree,somewhat_agree,somewhat_agree,somewhat_disagree,strongly_agree,somewhat_agree,somewhat_agree,somewhat_agree
cstscfmukpn,13580,27/03/2022@20:42:48,null,1440,900,1376,1214,18,female,white,not_hispanic,corrected,"I preferred the risky option every time. High risk high reward, plus the number of items on the screen didn't bother me too much no matter ow many items were there, it didn't really change how I worked the situation.",somewhat_agree,somewhat_agree,somewhat_disagree,somewhat_agree,somewhat_agree,somewhat_agree,somewhat_agree,somewhat_agree,somewhat_agree,somewhat_agree,neutral,somewhat_agree,neutral,somewhat_agree,neutral,neutral,somewhat_disagree,somewhat_agree
n36cf6d49s,13442,21/03/2022@20:35:42,null,1512,982,1512,1209,21,male,asian,not_hispanic,corrected,At first I liked outcomes that decreased the amount of objects but as I kept going I started to realize that I liked the ones that increased the amount of objects. For some reason I somehow felt like I was able to analyze the screen just as quick with more objects as with less.,neutral,neutral,neutral,neutral,neutral,neutral,neutral,neutral,neutral,neutral,neutral,neutral,neutral,neutral,neutral,neutral,neutral,neutral
421rlov84b1,13329,28/03/2022@16:28:12,null,1440,900,1324,1214,19,female,white,not_hispanic,corrected,I preferred the risky deck to add variety. But if the safe deck was -14+ I chose that one.,somewhat_agree,somewhat_agree,somewhat_disagree,somewhat_disagree,neutral,somewhat_disagree,somewhat_agree,somewhat_disagree,somewhat_agree,strongly_agree,strongly_agree,strongly_disagree,somewhat_agree,somewhat_agree,somewhat_agree,somewhat_disagree,somewhat_disagree,somewhat_agree
g7fg346lxzr,13356,03/04/2022@23:51:24,null,1792,1120,1792,1209,19,female,white,hispanic,normal,"When it was adding objects, it made more sense to choose the safe deck because it had a set number that was smaller than the one in the risky deck. When it was taking objects away, it was better to choose the risky deck that was subtracting a larger number of objects because even if that number wasn't selected, you wouldn't be worse off. ",neutral,somewhat_disagree,strongly_agree,somewhat_agree,somewhat_disagree,strongly_disagree,neutral,neutral,somewhat_agree,somewhat_disagree,somewhat_disagree,somewhat_agree,somewhat_disagree,neutral,neutral,somewhat_disagree,somewhat_agree,strongly_disagree
t8akxow9ju,13591,28/03/2022@14:33:39,null,1440,900,1431,1207,18,female,white,not_hispanic,normal,I liked the riskier one because the more blocks that appeared on the screen made it easier to pick out the red/green ones ,somewhat_agree,somewhat_disagree,somewhat_agree,somewhat_disagree,neutral,somewhat_disagree,somewhat_disagree,somewhat_agree,somewhat_agree,neutral,somewhat_agree,strongly_agree,somewhat_disagree,somewhat_agree,somewhat_agree,somewhat_disagree,neutral,somewhat_disagree
6fg1zo41lm,13355,03/04/2022@21:43:59,null,1440,900,1440,1214,,female,white,not_hispanic,corrected,"when objects were increased, the block was typically present ",strongly_agree,strongly_disagree,strongly_disagree,strongly_agree,strongly_agree,strongly_disagree,strongly_agree,strongly_agree,strongly_agree,neutral,neutral,neutral,strongly_disagree,strongly_disagree,strongly_disagree,strongly_agree,strongly_agree,strongly_disagree
blr3rybrd9t,13536,29/03/2022@13:11:57,null,1280,720,1263,1211,19,male,white,hispanic,corrected,"I noticed that I began choosing the risky addition options only when the ""plus"" symbol was removed.",somewhat_agree,somewhat_agree,strongly_disagree,strongly_disagree,neutral,somewhat_agree,somewhat_agree,neutral,strongly_agree,somewhat_disagree,strongly_disagree,neutral,neutral,somewhat_agree,neutral,strongly_agree,somewhat_disagree,somewhat_agree
hcwb4970jzh,11838,28/03/2022@10:49:37,null,1280,720,1263,1207,21,male,asian,not_hispanic,normal,,neutral,somewhat_agree,somewhat_disagree,somewhat_agree,neutral,somewhat_agree,neutral,somewhat_agree,neutral,neutral,somewhat_agree,somewhat_disagree,somewhat_agree,somewhat_agree,neutral,somewhat_disagree,neutral,neutral
9j5txqwfmsd,13335,28/03/2022@10:43:44,null,1440,900,1238,1209,18,female,"white,asian",not_hispanic,normal,"When it was all increase or all decrease, I tended to choose the riskier option because if it's going to increase or decrease, I may as well go all in.",somewhat_disagree,neutral,somewhat_disagree,neutral,somewhat_disagree,neutral,somewhat_disagree,neutral,somewhat_agree,somewhat_agree,somewhat_agree,somewhat_disagree,somewhat_agree,neutral,somewhat_agree,somewhat_disagree,neutral,neutral
ey33j9jr2gs,13496,28/03/2022@11:53:34,null,1440,900,1440,1214,,non-binary,na,na,na,I usually choose the safe option when the variance between the other two was very wide,strongly_agree,neutral,somewhat_disagree,somewhat_disagree,strongly_disagree,somewhat_agree,strongly_agree,strongly_agree,somewhat_agree,somewhat_agree,somewhat_agree,strongly_disagree,somewhat_agree,strongly_agree,strongly_agree,strongly_disagree,strongly_disagree,strongly_disagree
x68pko4ouc,13512,21/03/2022@20:57:21,null,1280,720,1263,1207,19,female,white,not_hispanic,corrected,"I tended to choose the safe deck when it required adding to the number, but sometimes chose risky when subtracting.",somewhat_agree,somewhat_agree,somewhat_disagree,somewhat_disagree,somewhat_disagree,strongly_agree,somewhat_disagree,strongly_disagree,somewhat_agree,strongly_agree,strongly_agree,strongly_disagree,somewhat_agree,somewhat_disagree,strongly_agree,strongly_agree,strongly_disagree,somewhat_agree
gvpkhg5l5,13366,21/03/2022@13:09:49,null,1440,900,1291,1214,19,male,white,not_hispanic,normal,"When taking the risk, I would usually do it if it was a large payout. For example if the left side was 4/20 and the right side was 12, I would take the chance of getting 4. I felt like with the larger numbers, there wasn't really much of a difference so I would just play it safe. ",somewhat_disagree,neutral,somewhat_agree,neutral,neutral,somewhat_disagree,somewhat_agree,somewhat_agree,somewhat_agree,neutral,somewhat_disagree,somewhat_agree,somewhat_disagree,somewhat_disagree,somewhat_disagree,somewhat_agree,somewhat_agree,somewhat_disagree
rizpa372xlm,13428,22/03/2022@18:45:23,null,1920,1080,1908,1218,21,male,white,not_hispanic,corrected,"I preferred taking a risk on the outcomes which had a chance of reducing the number of objects, but when it could increase the number of objects, I took the safer option where the outcome was known.",neutral,neutral,somewhat_disagree,somewhat_disagree,neutral,somewhat_agree,strongly_disagree,neutral,somewhat_agree,somewhat_agree,strongly_agree,strongly_disagree,somewhat_agree,strongly_agree,somewhat_agree,somewhat_disagree,strongly_disagree,somewhat_agree
oogjei95b1,13615,19/03/2022@14:16:10,null,1440,900,1442,1214,19,male,black,hispanic,normal,"I seemed to prefer the riskier option if it benefited me by subtracting a large amount of objects. I would say however, over time I would feel like the task was getting repetitive and began to rush to complete the tasks.",neutral,somewhat_agree,somewhat_disagree,neutral,neutral,neutral,neutral,neutral,neutral,neutral,neutral,neutral,neutral,neutral,neutral,neutral,neutral,neutral
